426|Валютный курс| — цена денежной единицы одной страны, выраженная в иностранных денежных единицах. Валютный курс определяется рынком — в процессе торгов на валютной бирже. Государства посредством центральных банков также участвуют в регулировании валютного курса, массово выбрасывая на рынок иностранную валюту для стабилизации курса, или наоборот — увеличивая предложение государственной валюты для ее девальвации.|Термин|Основы финансовых знаний|1|1|1||0
427|Выписка по банковскому счету| — финансовый документ (справка), выдаваемая банком клиенту, в которой отражены состояние счета клиента и движение средств на расчетном (текущем) счете на определенную дату.|Термин|Основы финансовых знаний|1|1|1||0
428|Выручка| — доход продавца от продажи товаров или услуг.|Термин|Основы финансовых знаний|1|1|1||0
429|Государственная управляющая компания| — финансовая компания, с которой у Пенсионного фонда России заключен договор доверительного управления средствами пенсионных накоплений граждан. |Термин|Основы финансовых знаний|1|1|1||0
430|Государственный бюджет| — план (смета) доходов и расходов государства на определенный период времени — как правило, на год (с 1 января по 31 января; но в отдельных странах бюджетный год (или фискальный, финансовый год) традиционно может не соответствовать календарному, а начинаться, например, с апреля или с октября, как в Японии или в США).|Термин|Основы финансовых знаний|1|1|1||0
431|Государственный служащий| — работник, занимающий ту или иную должность в государственных органах (на государственной службе) и получающий зарплату из государственного бюджета.|Термин|Основы финансовых знаний|1|1|1||0
432|Девальвация| — падение стоимости валюты относительно стоимости других валют (так называемых твердых валют). Прямым следствием такого обесценивания национальной валюты становится последующее удорожание импортируемых товаров и услуг. Исторически девальвацией называлось уменьшение стоимости денежной единицы, выраженной в золоте.|Термин|Основы финансовых знаний|1|1|1||0
433|Деноминация| — (от лат. |Термин|Основы финансовых знаний|1|1|1||0
434|Деньги| — универсальный товар, который может быть использован и для оплаты покупок других товаров (средство обмена), и для измерения ценности материальных благ (мера стоимости), и для осуществления платежей (долги, налоги), и для накопления (средство сбережения). |Термин|Основы финансовых знаний|1|1|1||0
435|Дефицит| — недостаточность средств, ресурсов в сравнении с ожидаемым или необходимым уровнем. Применительно к бюджету дефицитом называют превышение расходов над доходами.|Термин|Основы финансовых знаний|1|1|1||0
436|Дефляция| — последовательное протяженное во времени падение уровня цен. Это падение цен может вызвать снижение объема инвестиций в экономику, что, в свою очередь, приводит к дополнительному падению спроса и стимулирует дальнейшее падение цен на товары и сокращение объемов производства.|Термин|Основы финансовых знаний|1|1|1||0
437|Дефолт| — неспособность выполнить условия договора займа, отказ заемщика выплачивать проценты или основную сумму долга. Дефолт может быть объявлен как частным лицом, так и компанией и государством. Если существует возможность урегулировать отношения между кредитором и заемщиком и расплатиться по долгам в будущем, ситуация называется техническим дефолтом; в противном случае речь идет о банкротстве заемщика.|Термин|Основы финансовых знаний|1|1|1||0
438|Договор| — письменное соглашение между двумя и более сторонами, в котором определяются их взаимные обязательства, действия и взаимные платежи, оговорены права и обязанности всех участников. |Термин|Основы финансовых знаний|1|1|1||0
439|Доходность| — в общем случае — способность актива увеличивать свою стоимость во времени. Применительно к банковским вкладам, ценным бумагам и прочим финансовым инструментам — характеристика бумаги, отражающая соотношение дохода и базовой стоимости. Выражается обычно в процентах годовых.|Термин|Основы финансовых знаний|1|1|1||0
440|Жилищно-коммунальное хозяйство (ЖКХ)| — самостоятельная сфера народного хозяйства, включающая жилищное хозяйство (капитальный и текущий ремонт зданий), теплоснабжение, водоснабжение, электроснабжение, ремонт инженерных коммуникаций, а также благоустройство территорий, утилизацию мусора и уборку. Основной целью функционирования системы ЖКХ является предоставление жителям (потребителям) и предприятиям оплачиваемых жилищно-коммунальных услуг надлежащего качества.|Термин|Основы финансовых знаний|1|1|1||0
441|ЖКХ| — см. Жилищно-коммунальное хозяйство (ЖКХ)|Термин|Основы финансовых знаний|1|1|1||0
442|Иждивенец| — человек (как правило, не работающий), находящийся на длительном или постоянном материальном обеспечении другого человека.|Термин|Основы финансовых знаний|1|1|1||0
443|Импорт| — ввоз иностранных товаров из-за границы для переработки или реализации внутри страны; может относиться и к услугам, и к работам, и к объектам интеллектуальной собственности.|Термин|Основы финансовых знаний|1|1|1||0
444|Индекс потребительских цен| — (индекс инфляции) — показатель изменения среднего уровня цен на товары и услуги за определенный период.|Термин|Основы финансовых знаний|1|1|1||0
445|Индексация| — пересчет какой-либо денежной величины в соответствии с изменением темпа инфляции за определенный период: например, индексация номинальных доходов граждан (пенсий, пособий, социальных выплат и т. п.). Такая индексация является формой возмещения населению денежных потерь, вызванных ростом потребительских цен. Индексация может быть одним из условий договора – например, при кредитовании или при приеме вклада.|Термин|Основы финансовых знаний|1|1|1||0
446|Интернет-банк |— система удаленного доступа и управления своими банковскими счетами через интернет. Доступ с использованием индивидуального пароля клиент получает как со своего компьютера, так и с мобильных устройств, а денежные операции совершаются на сервере банка. Тарифы (комиссии) на банковские операции (перевод со счета на счет, конвертация, оплата услуг и т. д.) в интернет-банке, как правило, ниже, чем в отделении банка, или вовсе отсутствуют.|Термин|Основы финансовых знаний|1|1|1||0
447|Интернет-банкинг| — система дистанционного банковского обслуживания посредством сети интернет. Любой клиент банка, зарегистрировавшись в системе, может совершать все банковские операции, не выходя из дома. Создание «личного кабинета» с известным только клиенту логином и паролем позволяет видеть свои счета в данном банке, сохранять и просматривать всю историю по ним, проводить новые операции (например, оплату мобильной связи, жилищно-коммунальных услуг, телевидения, покупку билетов), настроить регулярные платежи, сберегая время и экономя на комиссионных затратах (в интернете они ниже, чем в офлайновом обслуживании).|Термин|Основы финансовых знаний|1|1|1||0
448|Интернет-платежи |— электронный сервис, позволяющий оплачивать товары и услуги в интернете. Интернет-платежи могут осуществляться посредством онлайн-банкинга, с помощью банковских карт или электронных денег.|Термин|Основы финансовых знаний|1|1|1||0
449|Инфляция| — (от лат. |Термин|Основы финансовых знаний|1|1|1||0
450|Казначейство России| — См. Федеральное казначейство (Казначейство России)|Термин|Основы финансовых знаний|1|1|1||0
451|Дебетовая карта| — банковская карта, привязанная к расчетному счету ее держателя (клиента банка). Основная функция дебетовой карты — хранение средств клиента для оплаты товаров и услуг, получения наличных денег в банкоматах, перевода средств клиентам других банков или того же банка. Средства на дебетовой карте принадлежат клиенту, приравниваются к вкладу и защищены системой страхования вкладов (см. АСВ).|Термин|Основы финансовых знаний|1|1|1||0
452|Дебетовая карта с овердрафтом| — разновидность дебетовой банковской карты, на которую зачисляются средства клиента. По такой карте клиент может получить дополнительную услугу — тратить не только свои, но и заемные средства банка в определенном разрешенном объеме, который и называется величиной овердрафта. |Термин|Основы финансовых знаний|1|1|1||0
453|Карточный счет| — банковский счет, которым клиент банка управляет посредством выпущенной банком пластиковой банковской карты. На карточный счет зачисляются средства, которые в дальнейшем используются с помощью карты. Полезно различать номер такого счета и номер собственно карты (в первом — 20 цифр, во втором — 16 или 18).|Термин|Основы финансовых знаний|1|1|1||0
454|Контрольно-кассовая машина (ККМ)| — кассовый аппарат, в обиходе просто касса — устройство, предназначенное для фиксирования оплаты товаров или услуг. По отчетам ККМ осуществляется контроль за денежными операциями со стороны государственных (например, налоговых) органов.|Термин|Основы финансовых знаний|1|1|1||0
455|Ключевая ставка| — минимальная ставка, по которой Банк России кредитует коммерческие банки по краткосрочным (недельным) кредитам. |Термин|Основы финансовых знаний|1|1|1||0
456|Коммерческий банк |— это кредитно-финансовая организация, которая имеет исключительное право осуществлять следующие операции: привлечение во вклады денежных средств физических и юридических лиц; размещение указанных средств от своего имени и за свой счет на условиях возвратности, платности, срочности; открытие и ведение банковских счетов физических и юридических лиц (Федеральный закон «О банках и банковской деятельности»). Банк действует как посредник, принимая вклады, выплачивая проценты по ним и выдавая ссуды, назначая заемщикам более высокие проценты. |Термин|Основы финансовых знаний|1|1|1||0
457|Кредитная карта| — банковская карта, которая позволяет клиенту использовать заемные средства банка для оплаты товаров и услуг или для снятия наличных и осуществления платежных операций. Сумма, которую можно использовать с карты, называется кредитным лимитом, устанавливается банком и зависит от характеристик заемщика — уровня его доходов, возраста, истории отношений с банком (и в целом от кредитной истории) и др.|Термин|Основы финансовых знаний|1|1|1||0
458|Криптовалюта| — это форма электронных (или цифровых) денег, то есть виртуальная валюта, в которой для проведения операций и для выпуска денежных единиц используется криптография. С помощью криптовалюты можно совершать все те же транзакции, что и с привычными деньгами, совершать международные платежи, оставаясь анонимным и избегая потерь на конвертации валют, т. к. криптовалюта не привязана к определенной стране. Никто не контролирует криптовалюту, ее эмиссия происходит посредством работы миллионов компьютеров по всему миру с использованием программ для вычисления математических алгоритмов. Вся система, по сути, является распределенной взаимозачетной сетью, с помощью которой продавцы и покупатели могут напрямую без посредников обмениваться виртуальными деньгами. Каждая цифровая «монета» уникальна и может использоваться лишь однажды, а пользователь анонимен, что является одной из главных особенностей использования виртуальных денег.|Термин|Основы финансовых знаний|1|1|0||0
459|Кэшбэк| — схема возврата на банковскую карту определенного (весьма небольшого) процента средств, потраченных при операциях с использованием карты. Некоторые банки выпускают дебетовые или кредитные карты с опцией кэшбэка для привлечения клиентов и повышения их лояльности, стимулирования их к использованию карты для безналичных платежей, то есть «возвращаемые» на карту средства являются разновидностью бонуса для потребителя за пользование услугами банка и конкретных торговых точек. |Термин|Основы финансовых знаний|1|1|1||0
460|Ликвидность| — легкость и быстрота, с которой тот или иной актив может быть переведен в деньги, то есть продан на рынке. |Термин|Основы финансовых знаний|1|1|1||0
461|Лицевой счет| — счет, на котором отражаются все финансовые взаимоотношения организации с определенным лицом — физическим или юридическим. Лицевые счета клиентов ведутся в банках, страховых компаниях, предприятиях коммунального обслуживания, в налоговой инспекции. Лицевой счет наемного сотрудника в бухгалтерии организации содержит сведения о начислениях, таких как заработная плата, премии, надбавки, пособия, компенсации и т. д.|Термин|Основы финансовых знаний|1|1|1||0
462|Льготный период| — 1). период, в течение которого обладатель банковской кредитной карты может пользоваться заемными средствами бесплатно — то есть, не уплачивая банку процент. Обычно продолжительность этого периода составляет 50–60 дней. Если в течение этого времени заемщик вернет на счет использованные деньги, то проценты на них начислены не будут.|Термин|Основы финансовых знаний|1|1|1||0
463|Маржа| — доход, возникающий из разницы цен покупки и продажи одного и того же продукта. Одновременно так называют саму разницу в ценах, курсах или ставках. Например, маржинальный доход от разницы цены покупки и цены продажи биржевых продуктов (ценных бумаг, валют); прибыль от продажи товара или услуги (разница между себестоимостью и рыночной ценой); разница между процентом по кредитам и процентом по депозитам (банковская маржа) и т. п.|Термин|Основы финансовых знаний|1|1|1||0
464|Министерство финансов Российской Федерации| — федеральное министерство, обеспечивающее проведение единой финансовой политики, а также осуществляющее общее руководство в области организации финансов. В ведении Минфина России— регулирование всей финансовой жизни страны, в т. ч.:|Термин|Основы финансовых знаний|1|1|1||0
465|Минфин России| — см. Министерство финансов Российской Федерации|Термин|Основы финансовых знаний|1|1|1||0
466|Мобильный банкинг| — услуга банка, позволяющая совершать различные операции с выпущенной этим банком карты и получать информацию о состоянии счетов и вкладов через мобильный телефон.|Термин|Основы финансовых знаний|1|1|1||0
467|Надбавка| — особая дополнительная плата: 1) работникам (надбавка к заработной плате) за особо сложные условия или высокое качество работы; 2) наценка, дополнительная стоимость товара, обусловленная его особыми качествами.|Термин|Основы финансовых знаний|1|1|1||0
468|Надежность| — способность выполнять взятые на себя обязательства и функции, сохранять неизменными (или мало изменяющимися) важные параметры. |Термин|Основы финансовых знаний|1|1|1||0
