620|Накопительный вклад| — разновидность срочного вклада. Такие вклады можно пополнять в течение срока хранения — при этом объем дополнительно вносимых сумм и частота внесения могут регламентироваться разными банками по-разному. Также подобные вклады могут подразумевать запрет на досрочное изъятие средств, либо допускать такую операцию — в зависимости от правил, предусмотренных в конкретном банке. |Термин|Основы финансовых знаний|1|1|1||0
621|Накопления| — см. Сбережения.|Термин|Основы финансовых знаний|1|1|1||0
622|Негосударственная пенсия| — денежные средства, регулярно выплачиваемые участнику в соответствии с условиями пенсионного договора. Пенсионный договор — соглашение между негосударственным пенсионным фондом (НПФ) и вкладчиком, в соответствии с которым вкладчик обязуется уплачивать пенсионные взносы в НПФ, а НПФ — выплачивать участнику фонда негосударственную пенсию. Выбранный гражданином НПФ или управляющая компания инвестируют средства накопительной части пенсии на финансовом рынке. Доходность пенсионных накоплений зависит от результатов их инвестирования. Гарантируется к выплате лишь сумма уплаченных страховых взносов.|Термин|Основы финансовых знаний|1|1|1||0
623|Негосударственный пенсионный фонд (НПФ)| — это специализированная финансовая организация, собирающая добровольные взносы вкладчиков и инвестирующая их на финансовом рынке для извлечения дохода и осуществления пенсионных выплат. В отличие от банков НПФ не могут гарантировать размер дохода, который они заработают для своих клиентов, и накопление средств в НПФ может оказаться более доходным, чем в банке, а может и наоборот. Преимущество НПФ как инструмента сбережения по сравнению с банками — более высокая надежность. Возврат сделанных взносов берет на себя Пенсионный фонд России и Агентство по страхованию вкладов (АСВ), правда, при этом инвестиционный доход может быть утерян.|Термин|Основы финансовых знаний|1|1|1||0
624|Пай инвестиционный| — именная ценная бумага, удостоверяющая, что у ее владельца (пайщика) есть право на долю имущества паевого инвестиционного фонда, а также погашения (выкупа) его пая по цене, соразмерной его доле в общей собственности фонда, и выплаты денежной компенсации и дивидендов, если правилами паевого инвестиционного фонда предусмотрена выплата дохода (Федеральный закон от 29.11.2001 № 156-ФЗ (ред. от 03.07.2016) «Об инвестиционных фондах», ст. 14 «Инвестиционные паи»).|Термин|Основы финансовых знаний|1|1|1||0
625|Пенсионный фонд| — организация, аккумулирующая взносы граждан для последующей выплаты всех видов пенсий. В зависимости от управляющей компании пенсионные фонды можно разделить на государственные и негосударственные.|Термин|Основы финансовых знаний|1|1|1||0
626|Сберегательный вклад| — разновидность срочного вклада. Такие вклады могут предусматривать возможность как их пополнения в течение срока действия договора, так и частичного изъятия средств — как правило, с предварительным уведомлением банка вкладчиком. Процентные ставки по таким депозитам ниже, чем по классическим срочным вкладам.|Термин|Основы финансовых знаний|1|1|1||0
627|Сберегательный сертификат| — Сберегательный сертификат — документ, удостоверяющий сумму вклада, на определенный срок внесенного в банк, и право владельца сертификата на получение указанной в нем суммы и процентов. В России держателями сберегательных сертификатов могут быть только физические лица.|Термин|Основы финансовых знаний|1|1|1||0
628|Сберегательный счет| — счет физического лица в банке, приносящий проценты и допускающий ограниченное число операций; может быть бессрочным, срочным и до востребования.|Термин|Основы финансовых знаний|1|1|1||0
629|Сбережения| — часть дохода, которая не используется для текущего потребления, а откладывается для потребления будущего — на черный день, на период пенсии, для крупных будущих приобретений, погашения задолженностей и т. п. |Термин|Основы финансовых знаний|1|1|0||0
630|Сложный процент| — это способ расчета процентов по вкладу, при котором происходит ежемесячное или ежеквартальное причисление процентов на банковский счет, причем в каждом следующем периоде проценты начисляются уже на бóльшую сумму, что увеличивает итоговую прибыль. В народе это называют «проценты на проценты», в математике — «сложные проценты». Но обычно процентная ставка по вкладу с капитализацией немного ниже, чем по стандартным вкладам, и, зарабатывая на капитализации, клиент, скорее всего, теряет на процентной ставке и наоборот. Поэтому, делая вклад, имеет смысл выбирать максимальную ставку, и если она будет с капитализацией процентов, то вы получите дополнительный доход.|Термин|Основы финансовых знаний|1|1|1||0
631|Срочный вклад| — денежные средства, отданные на хранение банку на определенный срок с целью получения процентного дохода.|Термин|Основы финансовых знаний|1|1|0||0
632|Страхование как инструмент сбережения| действует в формах накопительного страхования жизни и пенсионного страхования. Объектом защиты тут является не столько жизнь, сколько доход человека. Суть страхования в этом смысле — регулярное откладывание небольших сумм, которые станут незаменимым подспорьем в момент потери доходов, на черный день. Эти виды страхования предусматривают выплаты страховой суммы в следующих случаях: при потере здоровья, наступлении несчастного случая, инвалидности, частичной потери трудоспособности, тяжелого заболевания (онкологии и проч.), смерти застрахованного, при дожитии застрахованным до окончания срока страхования.|Термин|Основы финансовых знаний|1|1|1||0
633|Трудовая пенсия| — ежемесячная денежная выплата лицам достигшим пенсионного возраста, участникам системы обязательного пенсионного страхования. Основным источником средств для выплаты страховых пенсий становятся средства страховых взносов, производимых работодателями и индивидуальными предпринимателями в систему обязательного пенсионного страхования. Размер пенсии определяется отчислениями в государственный пенсионный фонд — Пенсионный фонд России (ПФР). |Термин|Основы финансовых знаний|1|1|1||0
634|Страховой полис| — документ, который выдается страховщиком (страховой компанией) страхователю (застрахованному) и подтверждает заключение договора страхования. Условия полиса закрепляют определенные права и обязанности как представителя страховщика, так и представителя страхователя. Принятие страхователем страхового полиса подтверждает его согласие с предложенными страховщиком условиями.|Термин|Основы финансовых знаний|1|1|1||0
635|Текущий счет| —вид бессрочного банковского вклада, который можно пополнять и с которого можно снимать средства по мере надобности в любое время, без предварительного уведомления, в необходимых количествах в пределах хранящейся на вкладе суммы.|Термин|Основы финансовых знаний|1|1|1||0
636|Условный вклад| — срочный или сберегательный вклад, подразумевающий выплату денег при определенных условиях, оговоренных при заключении договора. Может вноситься на имя другого лица, которое вправе распоряжаться им лишь при соблюдении определенных условий или при наступлении обстоятельств, указанных в договоре при открытии счета.|Термин|Основы финансовых знаний|1|1|1||0
637|Финансовая «подушка безопасности»| — сбережения на черный день, которые должны поддержать семью некоторое время, необходимое для того, чтобы приспособиться к новым жизненным условиям. В идеале размер этого резервного капитала должен быть достаточным для обеспечения семье прежнего уровня жизни в течение двух лет. Основные требования к активам, входящим в финансовую «подушку безопасности», — это ликвидность и надежность, т. к. эти деньги могут понадобиться в любой момент на обеспечение необходимых расходов.|Термин|Основы финансовых знаний|1|1|1||0
638|Целевой вклад| — долгосрочный и высокодоходный депозит с отложенным сроком получения основного капитала и процентов. Предназначен для накопления средств на некое отдаленное событие: к совершеннолетию или свадьбе ребенка, на приобретение вещей долговременного пользования.|Термин|Основы финансовых знаний|1|1|1||0
639|Автокредит| — целевой кредит на покупку транспортного средства с одновременным использованием его в качестве залога. Обязательные условия автокредита: использование для покупки конкретного, предварительно заявленного заемщиком автомобиля; автомобиль используется заемщиком, но находится в залоге банка-кредитора как гарантия возврата средств; комплексное страхование приобретаемого автомобиля (каско), покрывающее риски полной утраты или снижения его стоимости, обеспечивает финансовые интересы кредитора.|Термин|Основы финансовых знаний|1|1|1||0
640|Акцепт оферты| — ответ лица, которому адресована оферта, о ее принятии на предложенных условиях и согласии на оплату.|Термин|Основы финансовых знаний|1|1|1||0
641|Аннуитетный| платеж|Термин|Основы финансовых знаний|1|1|1||0
642|Банковские штрафы и пени| — наказание за просрочки платежей по кредитам, за отклонение от установленного графика оплаты. Банк вправе начислить штрафные санкции на сумму просроченной задолженности, а также на сумму всего просроченного долга за каждый день просрочки. |Термин|Основы финансовых знаний|1|1|1||0
643|Беззалоговый| кредит|Термин|Основы финансовых знаний|1|1|1||0
644|Бюро кредитных историй| — компания, в соответствии с законодательством оказывающая услуги по сбору, обработке и хранению кредитных историй, а также по предоставлению кредитных отчетов.|Термин|Основы финансовых знаний|1|1|1||0
645|Вексель| — это долговая ценная бумага, подтверждающая, что векселедатель взял взаймы у инвестора какую-либо сумму и обязуется вернуть ее в точно оговоренный срок с уплатой или без уплаты процентов.|Термин|Основы финансовых знаний|1|1|1||0
646|График платежей| — приложение к кредитному договору, в котором отражены все предстоящие обязательные платежи по кредиту. График платежей позволяет клиенту заранее знать, когда и сколько он должен выплатить.|Термин|Основы финансовых знаний|1|1|1||0
647|Дифференцированный платеж| — это ежемесячное погашение равных сумм основного долга и соответственно уменьшающихся процентов на невыплаченный остаток основного долга. В итоге при дифференцированном платеже размер ежемесячных выплат постоянно снижается. С точки зрения переплаты заемщику более выгодны дифференцированные платежи, а банку — аннуитетные. На небольших сроках разница в переплате незначительна, но при длинном сроке она становится все заметнее.|Термин|Основы финансовых знаний|1|1|1||0
648|Долг| — денежные средства или другие активы, которые кредитор передает заемщику с условием их возврата в будущем. Долг позволяет покрыть нехватку собственных ресурсов в настоящем, но создает обязательства, которыми необходимо грамотно управлять.|Термин|Основы финансовых знаний|1|1|1||0
649|Должник| — см. Заемщик.|Термин|Основы финансовых знаний|1|1|1||0
650|Досрочное погашение кредита| — действия заемщика по более быстрой выплате задолженности с целью уменьшения переплат. Добиться этого можно, погасив кредит досрочно полностью или частично. В первом случае на счет вносится сумма, равная остатку по основному долгу и начисленным на момент погашения процентам, после чего долг перед банком закрывается. Во втором случае заемщик вносит сумму, которая превышает ежемесячный платеж, указанный в графике. Кредит при этом не закрывается, но изменяется график его погашения: в нем уменьшится либо плановый платеж, либо срок кредитования. В обоих случаях сокращается сумма начисленных процентов, что выгодно заемщику и в чем совершенно не заинтересованы банки. Но Федеральный закон № 284-ФЗ «О внесении изменений в статьи 809 и 810 части 2 Гражданского кодекса РФ» официально запретил банкам взимать с заемщиков штрафы и пени при досрочном погашении, но не исключил возможности по мере сил затруднить или вовсе отказать заемщику в досрочном погашении кредита.|Термин|Основы финансовых знаний|1|1|1||0
651|Доступный лимит (кредитных средств)| — максимальная сумма, которую банк может предоставить своему клиенту — держателю кредитной карты на определенный срок. Размер этой суммы зависит от типа карты, платежеспособности клиента и его кредитной истории. В среднем кредитный лимит ограничивается 3–5 ежемесячными заработками клиента.|Термин|Основы финансовых знаний|1|1|1||0
652|Задолженность по договору| — сумма финансовых обязательств, денежных долгов, подлежащая возврату в определенный срок. Если к этому сроку задолженность не погашена, то она становится просроченной.|Термин|Основы финансовых знаний|1|1|1||0
653|Задолженность по кредиту| — не погашенная в срок задолженность по основному долгу, процентным выплатам или другим платежам по кредитному договору. С момента возникновения просрочки выплат по кредиту банк начисляет штрафы и пени, принципы расчета которых указываются в кредитном договоре. Неуплата нескольких платежей ведет к лавинообразному увеличению задолженности по кредиту, звонкам из банка, неблагоприятным отметкам в кредитной истории и т. п. Целесообразно самостоятельно инициировать диалог с банком при первых признаках такой ситуации. Банк также заинтересован в этом диалоге, поэтому можно рассчитывать на уступки с его стороны в виде «кредитных каникул», отсрочки платежей, снижения размеров неустойки, пеней и штрафных санкций и прочих вариантов безболезненного решения проблем задолженности по кредиту. |Термин|Основы финансовых знаний|1|1|1||0
654|Заем| — вид обязательств, договор, согласно которому одна сторона (заимодавец) передает деньги или материальные ценности другой стороне (заемщику) с условием возврата. Соглашение может заключаться между юридическими и физическими лицами как в письменной, так и в устной форме. Заем может быть не только беспроцентным (безвозмездным), но и под определенный процент (возмездным).|Термин|Основы финансовых знаний|1|1|1||0
655|Заемщик| — сторона в отношениях займа, получающая деньги в долг и принимающая на себя обязательство возвратить в установленный срок одолженную сумму и уплатить процент за время пользования деньгами.|Термин|Основы финансовых знаний|1|1|1||0
656|Заимодавец| — см. Кредитор.|Термин|Основы финансовых знаний|1|1|1||0
