226| Знакомимся с акциями|"Как было упомянуто в предыдущих уроках, акция - это ценная бумага, которая позволяет ее владельцу участвовать в управлении выпустившим ее акционерным обществом, получать долю от ее дохода (эту долю еще называют дивидендами), а при ликвидации компании - претендовать на его имущество. Держатель акций может распоряжаться ими на свое усмотрение и совершать с ними любую законную сделку. Те, кто уже владеет акциями, при приобретении их дополнительного количества имеют преимущество в своей доле перед другими покупателями.
Различают два типа акций: Обыкновенные - дают право на получение дивидендов и участие в управлении акционерным обществом. Одна акция дает один голос на собрании акционеров Привилегированные - дают право на получение дивидендов, но не позволяют участвовать в собрании акционеров  Доля прибыли, на которую может претендовать владелец такой акции, больше, чем у обыкновенной По сравнению с другими странами, в России более широкое применение получили привилегированные акции, так как они в большом количестве распространялись между сотрудниками предприятий во время приватизации. При этом закон разрешает держателю такой акции получить право голоса, но только в двух ситуациях - при длительных невыплатах дивидендов, либо при реорганизации акционерного общества."|Урок|Инвестирование|0|0|1|Инвестиции|0
227||Кстати, интересный факт! Инвестированием интересовались еще в древние времена. Согласно историческим данным, приблизительно в 1700 году до н.э. в Вавилоне были созданы Законы Хаммурапи, в которых были описаны основные правила инвестирования, кредитов и финансовых трансакций.|Факт|Инвестирование|0|0|1|Инвестиции|0
228| Знакомимся с облигациями|"Облигация – ценная бумага, как и акция, но это такой вид ценной бумаги, при котором компания или государство занимает деньги у инвесторов, и при этом четко прописывает, когда и сколько денег инвестор получит назад. Собственно, для инвестора как раз и важно понимать, когда он вернёт деньги и получит прибыль.
Облигации ярко характеризуются следующими характеристиками:
- Доход по ним выше, чем от вклада, но и риски выше, так как вклады застрахованы банком
- Доход можно рассчитать заранее, в отличие от акций
- Доход ниже, чем по акциям, но зато и риски ниже"|Урок|Инвестирование|0|0|1|Инвестиции|0
229||А Вы знали: В 1990-е гг. на Московской бирже торговался фьючерс на результаты президентских выборов в России. Цена контракта определялась исходя из оценки участниками рынка того, какой процент голосов наберут Борис Ельцин, Геннадий Зюганов и другие кандидаты. Участники рынка предсказали результаты первого и второго тура выборов точнее всех социологических служб, отмечают исследователи. Например, по результатам торгов котировки показывали, что Ельцин в 1 туре наберет 34,9 % — он набрал 35,02 %.|Факт|Инвестирование|0|0|1|Инвестиции|0
230| Знакомимся с производными (вторичными) ценными бумагами|"Кроме ценных бумаг, с которыми мы уже ознакомились, есть также и многие другие финансовые инструменты, в частности, фьючерсы и опционы. Некоторые называют их ценными бумагами или производными ценными бумагами, но в классической форме они таковыми не являются — это производные инструменты, или, как их еще называют, деривативы, то есть, активы срочного рынка.
Простым языком фьючерс, как и опцион, – это договор о том, что в будущем одна сторона продаст или купит что-то у другой стороны. Чаще всего это касается драгметаллов, сельскохозяйственной продукции и энергоресурсов: угля, нефти, газа.
Важно понимать, что фьючерсы и опционы — это почти всегда про спекуляции, игру на стоимости и рыночных ожиданиях. Например, вы оформляете фьючерсную сделку на покупку золота, ожидая, что его цена в будущем вырастет, и затем продаёте свой фьючерс, когда посчитаете, что она вот-вот обвалится."|Урок|Инвестирование|0|0|1|Инвестиции|0
231||Кстати! Мужчины и женщины инвестируют по-разному. Среди мужчин популярностью пользуются акции таких компаний как Tesla, Coca-Cola, Ford и Microsoft. Женщины выбирают менее трендовые акции, например, JP Morgan, Boeing и Netflix. Мужчины более активны со своими инвестиционными портфелями, но при этом у них на 25% больше шансов потерять свои вложения, чем у женщин.|Факт|Инвестирование|0|0|1|Инвестиции|0
232| Знакомимся со стратегиями инвестирования|"Без четкого плана действий может быть тяжело практически в любой жизненной ситуации. Это касается и торговли на фондовом рынке. Там у инвесторов есть свои стратегии, которые они применяют в зависимости от прибыли, которую они хотят получить или инструментов, которыми торгуют.
Под понятием стратегии инвесторы обычно понимают некую совокупность действий и методов для достижения поставленного финансового результата, тактику управления своим капиталом на рынке. Существует множество определений этого понятия, однако в наиболее общих чертах можно сказать, что инвестиционная стратегия – это чётко описанная последовательность действий, применяемая при тех или иных обстоятельствах на финансовом рынке, направленная на получение прибыли.
Как правило, разделяют следующие виды инвестиционных стратегий:
- Агрессивные
- Умеренные
- Консервативные"|Урок|Инвестирование|0|0|1|Инвестиции|0
233||Интересно знать! Пенсионный фонд Норвегии владеет 1% всех публично торгуемых акций мира и является самым крупным фондом национального благосостояния.|Факт|Инвестирование|0|0|1|Инвестиции|0
234| Брокерский счет или ИИС. Что выбрать?|"Кроме брокерского счета, инвесторы могут открыть ИИС — индивидуальный инвестиционный счет. Оба счета позволяют совершать операции на бирже, но у каждого есть ряд условий.
Брокерский счет — счет, на котором учитываются все сделки, операции и активы клиента по договору на брокерское обслуживание, а сами операции совершаются по поручению клиента на бирже или на внебиржевом рынке.
ИИС — индивидуальный инвестиционный счет. Вид брокерского счета для долгосрочных инвестиций с льготным налоговым режимом. Главное ограничение — деньги со счета нельзя выводить три года. Если вывести деньги в этот период, то счет закроется, а налоговых вычетов не будет (а полученные ранее придется вернуть).
До 2015 года в России для инвесторов не было разделений по типам счетов, но потом государство предложило долгосрочным инвесторам налоговые льготы на ИИС. Чтобы их получить, надо выполнить два условия:
- пополнять счет не более, чем 1 миллион рублей в год;
- не выводить деньги в течение трех лет после открытия.
Так появилось понятие ИИС — индивидуальный инвестиционный счет. По сути, это обычный брокерский счет с налоговыми льготами от государства. Такой счет может быть только один, но можно открыть брокерский счет и ИИС одновременно или выбрать один из них. У каждого счета есть свои особенности и преимущества."|Урок|Инвестирование|0|0|1|Инвестиции|0
235||Интересно знать! Рональд Уэйн был одним из основателей компании Apple. В 1976 году он продал свою долю в компании за $800. Сегодня его доля стоила бы $35 миллиардов. Но Уэйн заявил, что не сожалеет о продаже акций, потому что принял «лучшее решение из всех возможных, имея в тот момент на руках тот объём информации».|Факт|Инвестирование|0|0|1|Инвестиции|0
236| Налогообложение для инвестора|"Инвестор на фондовом рынке получает доход разными способами. Это и разница между ценой покупки и ценой продажи бумаги, и купонные выплаты по облигациям, и дивиденды . Все эти источники дохода облагаются налогом. Их государству платит за инвестора брокер. Так же, как работодатель вычитает сумму налога из вашей зарплаты.
К примеру, если Вы купили ценные бумаги на сумму ₽100 тыс., а продали за ₽140 тыс., ваша прибыль составит ₽40 тыс. Затем вы купили также на ₽100 тыс., но продали за ₽90 тыс., то тут ваш убыток составит ₽10 тыс. В итоге вам нужно будет заплатить налог с суммы ₽30 тыс.
Если вы налоговый резидент России, то вам придется заплатить 13% со своей прибыли. Если вы иностранец — 30%. Брокер удержит за вас налог и перечислит его в государственный бюджет по итогам года.
Это касается всех ценных бумаг. Но при торговле акциями иностранных компаний и облигациями  есть некоторые дополнительные особенности.
Если вы покупаете иностранные акции, то доходом считается разница между суммой покупки и продажи в рублях. Например, если вы купили акцию за $20 при курсе ₽60 за $1 и продали за те же $20, но при курсе ₽70 за $1, то вам придется заплатить налог с ₽10 за каждую акцию."|Урок|Инвестирование|0|0|1|Инвестиции|0
237||Кстати! У компании ВТБ одни из самых низких брокерских комиссий на рынке! И это не считая множества других преимуществ! Скачай приложение ВТБ Мои инвестиции, чтобы узнать больше!|Факт|Инвестирование|0|0|1|Инвестиции|0
238||Важно знать! Лучше всего кредитный рейтинг повышают долгосрочные кредиты с высоким процентом: например, кредитные карты.|Факт|Займы и кредиты|0|1|1|Кредит|0
239| Кредитный рейтинг|Кредитный рейтинг - это оценка того, насколько заёмщик надёжен. Такой рейтинг есть у каждого совершеннолетнего жителя Российской Федерации. От рейтинга зависит, получит ли заёмщик кредит, и какие условия ему предложит банк.|Урок|Займы и кредиты|0|1|1|Кредит|0
240||Кстати! При покупке потребительских товаров, воспользоваться мерами государственной поддержки не получится.|Факт|Займы и кредиты|0|1|1|Кредит|0
241| Льготные условия кредитования|Государство заинтересовано, чтобы экономика росла и уровень жизни в стране был высоким. Благодаря этому на некоторые категории кредитов есть специальные программы: например, молодая семья может взять льготную ипотеку. Заёмщику важно знать, что такие кредиты действуют с рядом условий и ограничений. Например, взять их можно только на полезные нужды.|Урок|Займы и кредиты|0|1|1|Кредит|0
242||Будьте осторожны! Под вывеской микрофинансовой организации могут скрываться мошенники. Лучше обращаться к надежному и честному заемщику, например, банку ВТБ|Факт|Займы и кредиты|0|1|1|Кредит|0
243| Особенности кредитования|На первый взгляд кажется: чем короче срок кредита, тем более выгодным и лёгким он будет для заёмщика. Но на самом деле самыми выгодными являются самые популярные инструменты. Так кредитная карта будет выгоднее, чем кредит наличными, а кредит у лицензированного банка будет на меньший процент, чем у микрофинансовой организации.|Урок|Займы и кредиты|0|1|1|Кредит|0
244||Внимание! При обращении за кредитом никто и никогда не рассказывает обо всех подводных камнях и опасностях, которые таятся в подписываемом кредитном договоре, при оформлении кредитной карты или при приобретении товара или услуги в кредит. Лучше обращаться к надежному и честному заемщику, например, банку ВТБ|Факт|Займы и кредиты|0|1|1|Кредит|0
245| Ограничения при взятии кредита|Собственность, на которую взят кредит, находится под обременением: для заёмщика это значит, что нужно обязательно страховать автомобиль или собственную жизнь и здоровье в случае ипотеки. Однако использовать собственность можно без ограничений: вести бизнес, делать в квартире ремонт и так далее. Если с платежами всё хорошо, банк вашу собственность не контролирует: в отличие, например, от арендодателя.|Урок|Займы и кредиты|0|1|1|Кредит|0
246||Интересный факт: Есть достаточно много людей, которые берут кредиты, не уточняя, например, правила их погашения. И итогом может стать испорченная кредитная история. Будьте внимательны.|Факт|Займы и кредиты|0|1|1|Кредит|0
247| Кредитная история|Кредитная история зависит от дисциплины платежей: это самая важная характеристика. Количество кредитов имеет значение в случае, если погашение проходило успешно. Если у банка с заёмщиком были проблемы, история испортится и банки перестанут подтверждать ему кредиты.|Урок|Займы и кредиты|0|1|1|Кредит|0
248|| У банковского вклада тоже есть свои риски. Это, например, как риск банкротства банка, так и валютный, процентный риски. Выбирая банк ВТБ в качестве заемщика Вы можете быть уверены в нивелировании большинства из этих рисков.|Факт|Личные сбережения и пенсии|1|1|1|Депозит|0
249| Банковский вклад|Банковский вклад - самый консервативный инструмент, потому что он застрахован государством. Хранить деньги на таком счёте безопаснее, чем дома. Обезличенный металлический счёт стоит открывать только в надёжном банке, чтобы не потерять сбережения при банкротстве. А индивидуальный инвестиционный счёт для самых рискованных: активы на нём изменяются в цене, и страховки у счета нет.|Урок|Личные сбережения и пенсии|1|1|1|Депозит|0
250||Всегда отслеживайте свои возможности для получения вычета или льгот. По статистике, более 80% людей, ни разу не использовавших налоговый вычет, просто не знали, что имеют на это право|Факт|Личные сбережения и пенсии|1|1|1|Инвестиции|0
251| Куда вложить сбережения?|Недвижимость и банковские вклады - это популярные, но не самые выгодные активы. При открытии индивидуального инвестиционного счета можно получить налоговый вычет в размере 13% от вложенных средств: иногда это выгоднее, чем открывать банковский вклад.|Урок|Личные сбережения и пенсии|1|1|1|Инвестиции|0
252||Наличие внуков или пожилых родственников - не повод получить пенсию раньше, поэтому в зрелом возрасте лучше заранее задуматься о пассивном доходе. Скачайте приложение ВТБ Мои Инвестиции и узнайте об этом больше.|Факт|Личные сбережения и пенсии|1|1|1|Депозит|0
253| Особенности пенсионных выплат|Возраст выхода на пенсию зависит от стажа на месте работы и возраста: учитывается количество пенсионных баллов и общая длительность. Сотрудники государственных предприятий также получают льготы и выходят на пенсию раньше.|Урок|Личные сбережения и пенсии|1|1|1|Депозит|0
254|| У банковского вклада тоже есть свои риски. Это, например, как риск банкротства банка, так и валютный, процентный риски. Выбирая банк ВТБ в качестве заемщика Вы можете быть уверены в нивелировании большинства из этих рисков.|Факт|Личные сбережения и пенсии|1|1|1|Депозит|0
255| Особенности банковского вклада|"Одна из самых действенных и популярных стратегий - постоянно откладывать понемногу. Таким образом, положить на вклад 5 000 рублей сегодня выгоднее, чем 120 000 рублей через 2 года. Сложный процент прибавляет прибыль за предыдущий месяц к вкладу, и доход вырастает методом ""снежного кома""."|Урок|Личные сбережения и пенсии|1|1|1|Депозит|0
256||Всегда отслеживайте свои возможности для получения вычета или льгот. По статистике, более 80% людей, ни разу не использовавших налоговый вычет, просто не знали, что имеют на это право|Факт|Личные сбережения и пенсии|1|1|1|Депозит|0
